{
  "connector_version": "UAC-1.0.0",
  "request_id": "req-20260216-0001",
  "trace_id": "trace-a63e302c-7418-4c8d-9c75-33cb970fee76",
  "evaluated_at_utc": "2026-02-16T23:40:02Z",
  "decision": "PASS",
  "reason": "Sufficient grounded evidence under current policy.",
  "gate_results": {
    "invariance_lambda": 1.0,
    "identifiability_pass": true,
    "policy_pass": true,
    "execution_gate_w3_pass": true,
    "multiplicative_zero_applied": false,
    "foundation_lock_triggered": false
  },
  "scores": {
    "rank_score": 1.0,
    "evidence_count": 2,
    "admissibility_delta": 0.82
  },
  "forensic": {
    "source_refs": [
      "https://docs.example.com/rev-policy",
      "https://sec.gov/filing/000000001"
    ],
    "ledger_recorded": true,
    "ledger_entry_id": "ledger-20260216-00001",
    "step_trace_included": true,
    "model_weights_disclosed": false,
    "response_hash_sha256": "cccccccccccccccccccccccccccccccccccccccccccccccccccccccccccccccc"
  },
  "remediation": []
}
